job_id,titles,teasers,companies,locations,categorys,subCategories,job_types,salaries,dateposted,datedisplay
75071091,Data Scientist,"Aptar Digital Health is a pioneering healthcare technology company, committed to leveraging cutting-edge technologies to solve real-world problems ...",Aptar Digital Health,Central Region,Science & Technology,"Mathematics, Statistics & Information Sciences",Full time,,2024-04-11T09:02:00Z,12d ago
75245843,"Fraud Business Analyst - Fraud, Regional Operations",--,SHOPEE SINGAPORE PRIVATE LIMITED,Central Region,Information & Communication Technology,Business/Systems Analysts,Full time,,2024-04-19T01:30:05Z,4d ago
75214594,"Business Analyst, Regional Operations (Return and Refund)",--,SHOPEE SINGAPORE PRIVATE LIMITED,Central Region,Information & Communication Technology,Business/Systems Analysts,Full time,,2024-04-18T00:29:27Z,5d ago
75139832,MI Data Sourcing Analyst,The role is responsible for sourcing data for the analytics solutions within the Transformation Programme. The individual will work very closely wi...,Prudential (WM Group- Linda Quah),Central Region,Science & Technology,"Mathematics, Statistics & Information Sciences",Full time,,2024-04-15T08:29:00Z,8d ago
75139996,Marketing Intelligence and Data Analyst Intern,We are seeking a highly motivated and detail-oriented Marketing Intelligence and Data Analyst Intern to join our team. This internship offers an ex...,GUARDANT HEALTH PTE. LTD.,Central Region,Banking & Financial Services,Analysis & Reporting,Casual/Vacation,,2024-04-15T08:19:00Z,8d ago
75120695,Data & AI Consulting Manager,-,NCS Pte Ltd,Central Region,Science & Technology,"Mathematics, Statistics & Information Sciences",Full time,"$10,000 – $15,000 per month",2024-04-15T01:52:43Z,8d ago
75000007,Data Analyst - Service Channels & Transformation,We are looking for a talented Data Analyst to join our Service Channels and Transformation team. The ideal candidate will have a passion for data a...,OCBC (Singapore),Central Region,Information & Communication Technology,Business/Systems Analysts,Full time,,2024-04-08T09:37:00Z,15d ago
75230484,Machine Learning Engineer Intern - PaidAds (Summer 2024),-,SHOPEE SINGAPORE PRIVATE LIMITED,Central Region,Information & Communication Technology,Engineering - Software,Full time,,2024-04-18T08:19:49Z,5d ago
75206668,"User Growth Data Analyst, TikTok",About TikTok TikTok is the leading destination for short-form mobile video. Our mission is to inspire creativity and bring joy. TikTok has global o...,TIKTOK PTE. LTD.,Central Region,Science & Technology,"Mathematics, Statistics & Information Sciences",Full time,,2024-04-17T12:39:00Z,6d ago
75332181,BI Engineer APAC,"In this position, located in Singapore, you are reporting to Chief Business Development Office APAC, who oversees the development of Data Strategy ...",ASENDIA SINGAPORE PTE. LTD.,Central Region,Science & Technology,"Mathematics, Statistics & Information Sciences",Full time,,2024-04-22T14:12:00Z,1d ago
75098406,"Manager, AIO Value Driven Outcomes Office","As a Data Insights Manager at NUHS's Value Driven Outcomes Office, you will play a pivotal role in leveraging data from clinical, administrative, a...",National University Health System,Central Region,Science & Technology,"Mathematics, Statistics & Information Sciences",Full time,,2024-04-12T11:38:00Z,11d ago
75344390,Medical Statistician (Research/Novena/Office Hours) (ID: 571356),Collaborate with multidisciplinary research team to design and develop methodologies for clinical research and trials,PERSOLKELLY Singapore Pte Ltd (Formerly Kelly Services Singapore Pte Ltd),Central Region,Healthcare & Medical,Clinical/Medical Research,Full time,,2024-04-23T04:07:42Z,10h ago
75273823,Business Intelligence Intern (Fall 2023),The Business Intelligence and Data Analytics team plays a critical role in conducting close-loop data-driven business iterations. As business...,SHOPEE SINGAPORE PRIVATE LIMITED,Singapore,Science & Technology,"Mathematics, Statistics & Information Sciences",Contract/Temp,,2024-04-19T07:48:41Z,4d ago
75149520,"Analyst, Assistant Manager (3PL MNC)",Good salary package with career advancement opportunities,MCI Career Services Pte Ltd,East Region,"Manufacturing, Transport & Logistics","Warehousing, Storage & Distribution",Full time,"$5,000 – $7,200 per month",2024-04-16T01:39:22Z,7d ago
75297889,[LTA-RAOM] SENIOR / EXECUTIVE / ENGINEER (DATA STANDARDS AND INFORMATION),"As a key member of the team, you will work collaboratively with cross-functional teams from various disciplines within LTA, rail operators, contrac...",Public Service Division,Central Region,Information & Communication Technology,Testing & Quality Assurance,Full time,,2024-04-19T21:12:00Z,3d ago
74904801,Business Intelligence & Data Analytics Manager/Senior Manager,"6) Conduct in-depth data analysis to identify trends, patterns, and opportunities for process improvement or business growth.
7) Optimize data mode...",CHARLES & KEITH GROUP,Central Region,Information & Communication Technology,Database Development & Administration,Full time,,2024-04-03T16:35:00Z,19d ago
75329602,"VP, Data Governance, Data Management Office","DMO believes that data is key to responsible innovation, growth, and competitive advantage in the banking industry. Our mission is to leverage our ...",United Overseas Bank Limited (UOB),Central Region,Information & Communication Technology,Product Management & Development,Full time,,2024-04-22T12:59:00Z,1d ago
75271004,Senior Promotion Intelligence Algorithm Engineer - Marketplace Intelligence and,-,SHOPEE SINGAPORE PRIVATE LIMITED,Central Region,Science & Technology,"Mathematics, Statistics & Information Sciences",Full time,,2024-04-19T07:10:12Z,4d ago
75296320,Analyst,Achieve your fullest potential with opportunities to build your technical expertise and hone your competencies in diverse domains. You can also exp...,Defence Science and Technology Agency (DSTA),Central Region,Engineering,Electrical/Electronic Engineering,Full time,,2024-04-20T10:45:00Z,3d ago
75239172,Data Engineer (PowerBI/Python),"Stay up-to-date with emerging trends and technologies in data engineering and PowerBI.
Manage projects from POC to production deployment.
Primarily...",ASTEK Singapore Innovation Technology Pte. Ltd.,Central Region,Information & Communication Technology,Engineering - Software,Full time,,2024-04-18T14:51:00Z,5d ago
75305691,Big Data,"Big Data (Full Time)
Location In Singapore: Islandwide
Salary(SGD): 6000 - 10000
Apply
Job Description:
· Analysing requirements, designing, develo...",Goldtech Resources Pte Ltd,Central Region,Information & Communication Technology,Developers/Programmers,Full time,,2024-04-19T07:06:00Z,4d ago
75244103,"Business Intelligence Executive - Business Intelligence, Quality",-,SHOPEE SINGAPORE PRIVATE LIMITED,Singapore,Information & Communication Technology,Business/Systems Analysts,Full time,,2024-04-19T01:03:40Z,4d ago
75226785,Junior Data Patching Administrator,"a. Perform the data rectification as detailed in Service Requests (SR). Where required, clarify requirements in the SR with the requester or other ...",OPUS IT Services Pte Ltd,Central Region,Information & Communication Technology,Database Development & Administration,Contract/Temp,,2024-04-18T02:39:00Z,5d ago
75105144,Data Science Engineer /Chemical Manufacturing Industry!,"- Plan, manage and lead data science projects",TempServ Pte Ltd,West Region,Science & Technology,Materials Sciences,Full time,"$4,000 – $4,800 per month",2024-04-13T01:52:24Z,10d ago
75246704,"Brand Analytics Intern, Regional Brand Partnerships (Spring 2024)",-,SHOPEE SINGAPORE PRIVATE LIMITED,Central Region,Marketing & Communications,Brand Management,Full time,,2024-04-19T01:40:58Z,4d ago
75139629,Video Analytics System Specialist,System Design and Implementation:Collaborate with clients to understand their security needs and design a video analytics system that meets their s...,MTS SYSTEMS ENGINEERING PTE. LTD.,Central Region,Engineering,Electrical/Electronic Engineering,Full time,,2024-04-15T08:22:00Z,8d ago
75206153,"Manager, Marketing - Audience Intelligence (Senior Data Analyst)","If you love working with technology to create solutions and are not afraid to roll up your sleeves to get things done, you will find your tribe her...",FOODPANDA SINGAPORE PTE. LTD.,Central Region,Accounting,Analysis & Reporting,Full time,,2024-04-17T12:19:00Z,6d ago
75191563,Internship - Data Engineer,"Does this sound like just the right challenge for you? If so, we look forward to getting to know you!",Infineon Technologies,Central Region,Information & Communication Technology,Engineering - Software,Contract/Temp,,2024-04-17T05:57:33Z,6d ago
75188781,Assistant Analytics Specialist,"This role will gather, analyse and interpret data to monitor market trends, gather competitive intelligence and generate sourcing opportunities",Lidl & Kaufland Asia Pte. Limited,Central Region,Consulting & Strategy,Analysts,Contract/Temp,"$3,800 – $5,000 per month",2024-04-17T04:12:16Z,6d ago
75287645,Intern - Finance Technology Transformation,"• Assist with integration, data transformation and migration for core ERP migration project
• Particpate in testing and verfication, including hand...",Singapore Post Limited,Central Region,Information & Communication Technology,Programme & Project Management,Full time,,2024-04-19T16:58:00Z,3d ago
75305820,BI Consultant,"Responsible for collecting, processing, and integrating data from multiple sources, analyse the data and produce the required output in data visual...",Goldtech Resources Pte Ltd,Central Region,Information & Communication Technology,Business/Systems Analysts,Full time,,2024-04-19T07:07:00Z,4d ago
75308716,"Assistant / Manager, Finance",-,SingHealth Polyclinics,Central Region,Accounting,Other,Full time,,2024-04-22T02:15:54Z,1d ago
75144008,Internship – Product Engineering: Data Scientist,"The student, as part of the Product Engineering team, will be involved in development, optimization and maintenance of automation projects, related...",Infineon Technologies,Central Region,Science & Technology,"Mathematics, Statistics & Information Sciences",Casual/Vacation,,2024-04-14T14:33:00Z,9d ago
74893454,"HRBP (Regional, Data Analytics, HR Policies)","We are looking for an experienced HRBP who has handled regional HR responsibilities, taking a consultative approach to different BU Managers/Heads.",Future Electronics Inc (Distribution) Pte Ltd,East Region,Human Resources & Recruitment,Consulting & Generalist HR,Full time,,2024-04-03T08:45:03Z,20d ago
75220053,Junior Data Patching Administrator,5 days work week,OPUS IT Services Pte Ltd,West Region,Information & Communication Technology,Database Development & Administration,Full time,"$3,500 – $3,800 per month",2024-04-18T03:16:36Z,5d ago
75227452,Big Data Architect,"Develop and implement data ingestion, processing, and storage solutions using Big Data technologies.
Optimize data pipelines for performance, scala...",Unison Consulting Pte. Ltd.,Central Region,Science & Technology,"Mathematics, Statistics & Information Sciences",Full time,,2024-04-17T04:33:00Z,6d ago
75206743,Senior Machine Learning Research Manager,"The Machine Learning team is responsible for delivering tangibly intelligent devices across all current and future product categories at Dyson.
Wor...",Dyson Operations Pte Ltd,Central Region,Banking & Financial Services,Banking - Corporate & Institutional,Full time,,2024-04-17T13:02:00Z,6d ago
75342917,"Deputy/Assistant Director, Environmental Risk Management",You will be part of a team responsible for the formulation and implementation of supervisory initiatives on environmental risk management for Singa...,Public Service Division,Central Region,Accounting,Management,Full time,,2024-04-23T01:37:00Z,13h ago
75098414,"Assistant Manager, AIO Management Decision Support Office","At NUHS Academic Information Office – Management Decision Support Office, we support the organisation in drawing meaningful insights and develop au...",National University Health System,Central Region,Science & Technology,"Mathematics, Statistics & Information Sciences",Full time,,2024-04-12T11:38:00Z,11d ago
75161394,"Enterprise Analytics, Specialist / Consultant (Business Intelligence)","Join us today as Enterprise Analytics, Specialist / Consultant (Business Intelligence) today!
Someone who is passionate about pushing boundaries fo...",AIA SINGAPORE PRIVATE LIMITED - GOH HOCK CHYE SAMUEL,Central Region,Sales,New Business Development,Full time,,2024-04-16T02:52:00Z,7d ago
75342878,"Vice President, Portfolio Management","Our goal is to hire the best and the brightest. We value intellectual horsepower first and foremost, and people who demonstrate an outstanding tale...",WORLDQUANT (SINGAPORE) PTE. LTD.,Central Region,Consulting & Strategy,Management & Change Consulting,Full time,,2024-04-23T01:44:00Z,13h ago
75290795,"Platform Solutions Developer (Reputable Bank, 12 months, Central)","Reputable bank looking for front office developer, proficient in Python, SQL, Tableau and Excel! Central area, 12 months contract.",RecruitFirst Pte. Ltd,Central Region,Banking & Financial Services,Banking - Corporate & Institutional,Contract/Temp,"$8,000 – $12,000 per month",2024-04-20T03:22:50Z,3d ago
75005251,"VP, Chief Analytics Officer, Asia",This position is responsible for supporting the execution of regional and local strategy by leveraging analytics and serve as a catalyst to optimiz...,Manulife (Singapore) Pte Ltd,Central Region,Banking & Financial Services,Analysis & Reporting,Full time,,2024-04-08T17:12:00Z,14d ago
74995625,Data Scientist (Contract),You will be part of the analytics team providing accurate information and analysis results to management and clinical departments.,Ng Teng Fong General Hospital,West Region,Science & Technology,"Mathematics, Statistics & Information Sciences",Contract/Temp,,2024-04-08T07:55:07Z,15d ago
75238707,Analyst Programmer (Project Management Office),"a. Prepare Variation Agreement (VA) documents for Change Requests (CRs) and seek approval from Authority.
b. Maintain the master CR lists and provi...",OPUS IT Services Pte Ltd,West Region,Information & Communication Technology,Management,Contract/Temp,,2024-04-18T14:56:00Z,5d ago
75002616,SAS Data Science AIML Program - Data Analyst Trainee,"SAS is committed to nurture qualified, capable individuals, and deepening the skills amongst fresh graduates and young working professionals to be ...",SAS Institute Pte Ltd,Central Region,Education & Training,Research & Fellowships,Contract/Temp,,2024-04-08T12:38:00Z,15d ago
75028555,Data Analyst,"At Pylon.AI, we believe in passion, teamwork, innovation, and simplicity. We strive to create a harmonious environment that fosters collaboration, ...",PYLON.AI PTE. LTD.,Central Region,Engineering,Electrical/Electronic Engineering,Full time,,2024-04-09T12:48:00Z,14d ago
75133427,Data Engineer Intern,Offers an excellent opportunity for individuals with a strong passion for data and eager to gain hands-on experience to expand project exposure.,IFS Capital Group,East Region,Science & Technology,"Mathematics, Statistics & Information Sciences",Contract/Temp,"$800 – $1,200 per month",2024-04-15T08:06:36Z,8d ago
75207477,"Machine Learning Researcher, LLM Agent","About ByteDance Founded in 2012, ByteDance's mission is to inspire creativity and enrich life. With a suite of more than a dozen products, includin...",BYTEDANCE PTE. LTD.,Central Region,Education & Training,Research & Fellowships,Full time,,2024-04-17T15:13:00Z,5d ago
75207606,Machine Learning Researcher - LLM Agent,"About ByteDance Founded in 2012, ByteDance's mission is to inspire creativity and enrich life. With a suite of more than a dozen products, includin...",BYTEDANCE PTE. LTD.,Central Region,Education & Training,Research & Fellowships,Full time,,2024-04-17T15:13:00Z,5d ago
75162913,"Consultant / Senior Consultant, Business Consulting","•       Conduct assessments of internal controls, identifies areas of improvement in business processes to better manage business risks•      ...",RSM Singapore,Central Region,Banking & Financial Services,Compliance & Risk,Full time,"SGD 3,500 - 4,900",2024-04-16T07:11:16Z,7d ago
75288456,P&C Associate Director / Director – Pricing and Data Science,"You will be responsible to drive the development of the P&C Product, Pricing, Claim and Underwriting (PPCU) and Data Science proposition in Southea...",Willis Towers Watson (WTW) - Insurance Services,Central Region,Information & Communication Technology,Management,Full time,,2024-04-19T18:39:00Z,3d ago
75196494,"Intern - Data Science & Engineering, SMAI","Deploys data science models and lead the end-to-end life cycle, including solution design, development, deployment, model maintenance and monitorin...",MICRON SEMICONDUCTOR ASIA OPERATIONS PTE LTD,Central Region,Science & Technology,"Mathematics, Statistics & Information Sciences",Full time,,2024-04-17T04:37:00Z,6d ago
75206613,"Director, Data Science","At American Express, you’ll be recognized for your contributions, leadership, and impact—every colleague has the opportunity to share in the compan...",AMERICAN EXPRESS INNOVATION LABORATORIES LIMITED (SINGAPORE BRANCH),Central Region,Information & Communication Technology,Team Leaders,Full time,,2024-04-17T13:40:00Z,6d ago
75179292,Visiting Fellow (Statistics and Data Science),The Department of Statistics and Data Science at the National University of Singapore invites applications for Departmental Postdoc Positions. Thes...,Yale-NUS College,Central Region,Science & Technology,"Mathematics, Statistics & Information Sciences",Full time,,2024-04-16T20:23:00Z,6d ago
75134907,Data Science Research Fellow (Heat Resilience & Performance Centre),Data Science Research Fellow (Heat Resilience & Performance Centre),National University of Singapore,Central Region,Education & Training,Other,Full time,,2024-04-15T09:05:23Z,8d ago
75341662,"Manager, Machine Learning Engineer, Group Market and Enterprise Technology",-,United Overseas Bank Limited (UOB),Central Region,Information & Communication Technology,Engineering - Software,Full time,,2024-04-23T03:11:24Z,11h ago
75276880,AI and Machine Learning Engineer,"As an ML Systems Engineer, you will play a fundamental role in building our state-of-the-art machine learning platform. You will get the chance to ...",Hewlett Packard Enterprise,Central Region,Information & Communication Technology,Developers/Programmers,Full time,,2024-04-19T03:23:00Z,4d ago
75301704,Manager of machine learning,Hawksman Technology is working with an exciting technology venture dedicated to transforming the interaction between brands and consumers in Southe...,Hawksman Technology,Central Region,Information & Communication Technology,Team Leaders,Full time,,2024-04-21T11:22:00Z,2d ago
75341324,"Scientist, AI,ISCE2",Innovating at the nexus of chemistry and biotechnology for sustainable chemical manufacturing and bioproducts development,"Agency for Science, Technology and Research (A*STAR)",West Region,Science & Technology,Other,Full time,,2024-04-23T03:02:38Z,11h ago
75180022,AI Engineer,"Support the production of scalable and optimised AI or machine learning (ML) models.
Focus on building algorithms for the extraction, transformatio...",ANTCHAIN TECHNOLOGY PTE. LTD.,West Region,Science & Technology,"Mathematics, Statistics & Information Sciences",Full time,,2024-04-16T20:20:00Z,6d ago
75140083,AI/ML - NLP Engineer,"Imagine what you could do here. At Apple, new ideas have a way of becoming great products, services, and customer experiences very quickly. Bring p...",Apple Inc.,North-East Region,Information & Communication Technology,Engineering - Software,Full time,,2024-04-15T08:20:00Z,8d ago
75270418,Senior Machine Learning Engineer - PaidAds,-,SHOPEE SINGAPORE PRIVATE LIMITED,Central Region,Information & Communication Technology,Developers/Programmers,Full time,,2024-04-19T06:57:22Z,4d ago
75331966,Senior AI Engineer,"Conduct research and experimentation to explore new approaches and techniques in AI and computer vision, applying findings to enhance algorithm cap...",Black Sesame Technologies (Singapore) Pte Ltd,Central Region,Information & Communication Technology,Team Leaders,Full time,,2024-04-22T14:15:00Z,1d ago
75287811,Machine Learning Researcher - LLM Agent,"Our NLP team focuses on natural language generation, improving the reasoning ability of language models, such as machine translation, natural langu...",BYTEDANCE PTE. LTD.,Central Region,Education & Training,Research & Fellowships,Full time,,2024-04-19T16:22:00Z,3d ago
75102708,Data Engineer Intern,Intern will be playing a key role in the revamp of existing data pipelines and building new pipelines that are essential for data analyst/data scie...,Razer Inc.,Central Region,Science & Technology,"Mathematics, Statistics & Information Sciences",Full time,,2024-04-12T19:01:00Z,10d ago
75198928,Machine Learning Engineer - Paid Ads (Campus Recruitment 2024),-,SHOPEE SINGAPORE PRIVATE LIMITED,Central Region,Information & Communication Technology,Engineering - Software,Full time,,2024-04-17T08:02:35Z,6d ago
75287404,Senior data engineer / developer - trading technology,"You'll be working at the intersection of trading and technology to transform markets around the world.
Requirements
Have 2-9 years of work experien...",Hunter Bond,Central Region,Information & Communication Technology,Developers/Programmers,Full time,,2024-04-19T16:53:00Z,3d ago
75270347,Promotion Algorithm Data Engineer - Marketplace Intelligence and Data,-,SHOPEE SINGAPORE PRIVATE LIMITED,Singapore,Information & Communication Technology,Engineering - Software,Full time,,2024-04-19T06:55:54Z,4d ago
75254198,R&D AI Engineer,Identify/plan/realize deep learning and AI business models.,LITE-ON SINGAPORE PTE LTD,North-East Region,Information & Communication Technology,Developers/Programmers,Full time,,2024-04-19T03:14:49Z,4d ago
75161567,Lead Data Scientist II,"Involves providing unique, high impact, technical or expert advice to directors or officers within a region or internationally. Data Science; Advan...",Federal Express (S) Pte Ltd,Central Region,Banking & Financial Services,Analysis & Reporting,Full time,,2024-04-08T12:38:00Z,15d ago
75332015,Quantitative Analyst,"As a Quantitative Analyst in the blockchain industry, you will play a pivotal role in developing sophisticated quantitative models and analytical t...",TXT TECHNICAL PTE. LTD.,Central Region,Banking & Financial Services,Analysis & Reporting,Full time,,2024-04-22T14:14:00Z,1d ago
75253041,Regional Risk & Compliance Modeling Intern - Digital Banking (May to Aug 2024),--,SHOPEE SINGAPORE PRIVATE LIMITED,Central Region,Banking & Financial Services,Compliance & Risk,Contract/Temp,,2024-04-19T03:00:43Z,4d ago
75227046,Quantitative Researcher,"The quantitative researchers design and backtest trading models, which form the most important elements in the final trading strategies. They work ...",DYNAMIC TECHNOLOGY LAB PRIVATE LIMITED,Central Region,Science & Technology,"Mathematics, Statistics & Information Sciences",Full time,,2024-04-18T02:39:00Z,5d ago
75260831,Backend Engineer Intern - Data Infra (Summer 2024),-,SHOPEE SINGAPORE PRIVATE LIMITED,Central Region,Information & Communication Technology,Engineering - Software,Full time,,2024-04-19T04:11:31Z,4d ago
75206518,Data Engineer,"• At least 5 years of experience working as a data engineer or backend developer in a big data field.
• Solid working knowledge of implementing the...",TECHNOPALS CONSULTANTS PTE. LTD.,West Region,Information & Communication Technology,Developers/Programmers,Contract/Temp,,2024-04-17T13:42:00Z,6d ago
75287946,Senior data management professional - data engineer - events,"Our Events and Transcripts Data team is seeking a Data Engineer to help us drive the data set forward. The team provides our users with complete, a...",Bloomberg Singapore Pte. Ltd.,Central Region,Science & Technology,"Mathematics, Statistics & Information Sciences",Full time,,2024-04-19T16:53:00Z,3d ago
74916366,Data Science Intern to Perm,"This internship offers hands-on experience working on data science projects for our clients. As an intern, you'll gain valuable skills in understan...",Bioquest Advisory,Central Region,Science & Technology,"Mathematics, Statistics & Information Sciences",Full time,,2024-04-04T00:41:00Z,19d ago
75144844,Professional Officer (All Levels) in Generative AI (SPICE),"Experienced in developing machine learning and generative AI solutions for deployment into production.
Strong proficiency in Python and AI framewor...",Singapore Institute of Technology,Central Region,Information & Communication Technology,Team Leaders,Contract/Temp,,2024-04-15T19:21:00Z,7d ago
74951438,Temporary Executive (Statistics and Data Science),Temporary Executive (Statistics and Data Science),National University of Singapore,Central Region,Education & Training,Other,Full time,,2024-04-05T06:35:58Z,18d ago
75140307,AI Scientist/Research Scientist,"Research and develop large language model powered product and systems, primarily within the mental health related area.
Work with data scientist/en...",SHANDA GROUP PTE. LTD.,Central Region,Science & Technology,"Mathematics, Statistics & Information Sciences",Full time,,2024-04-15T08:21:00Z,8d ago
75301739,Research engineer,"As a key member of our AI team, your primary responsibilities will revolve engineering challenges around building high-quality multimodal models, s...",HYPERGAI PTE. LTD.,Central Region,Science & Technology,"Mathematics, Statistics & Information Sciences",Full time,,2024-04-21T11:22:00Z,2d ago
