job_id,titles,teasers,companies,locations,categorys,subCategories,job_types,salaries,dateposted,datedisplay
74706904,"Data Analyst, Strategy Management and Analytics (OPP)",The Strategy Management &amp; Analytics team is the custodian of SGH’s corporate strategy management and business intelligence to enhance...,Singapore General Hospital,Central Region,Science & Technology,"Mathematics, Statistics & Information Sciences",Full time,,2024-03-25T08:10:06Z,1d ago
74723396,Operations Data Analytics,"Challenging job by analysing operational data to identify issues, communicate with various BU heads to solve issues and improve workflows",Best Logistics Technology (Singapore) Pte Ltd,West Region,"Manufacturing, Transport & Logistics",Analysis & Reporting,Full time,"$2,700 – $4,000 per month",2024-03-26T01:32:46Z,12h ago
74734719,Operation Data Analytics Officer,The Quality Control team at BEST is responsible for the maintenance and improvement of operational service quality. Reporting directly to our Singa...,Best Logistics Technology (Singapore) Pte Ltd,West Region,"Manufacturing, Transport & Logistics",Freight/Cargo Forwarding,Full time,,2024-03-26T03:10:00Z,10h ago
74734440,Data Science and Analytics Specialist,"Responsible for enabling decision making by exploring the data, recommending actionable insights, and building visualizations, dashboards.
Packages...",Philips Domestic Appliances Singapore Pte. Ltd.,Central Region,Sales,New Business Development,Full time,,2024-03-26T03:44:00Z,9h ago
74716968,Senior Backend Developer (AI Data Analytics),"The JobTech team is an enthusiastic bunch, obsessed with solving human capital business problems in talent development, using deep technology and l...",Jobtech Pte. Ltd.,West Region,Information & Communication Technology,Developers/Programmers,Full time,,2024-03-25T15:02:00Z,22h ago
74727949,Research Fellow / Engineer (Lifecycle Sustainability Assessment / Data Analytics,-,Singapore Institute of Technology,Central Region,Education & Training,Research & Fellowships,Contract/Temp,,2024-03-26T03:37:16Z,10h ago
74714569,"VP, Data Analytics, Group Wholesale Banking",-,United Overseas Bank Limited (UOB),Central Region,Banking & Financial Services,Other,Full time,,2024-03-25T17:59:18Z,19h ago
74716684,Data Scientist / Data Analyst,We are seeking a highly skilled and motivated Data Analyst/Data Scientist to join our dynamic team. The ideal candidate will be passionate about tu...,CHARLES & KEITH GROUP,Central Region,Science & Technology,"Mathematics, Statistics & Information Sciences",Full time,,2024-03-25T15:03:00Z,22h ago
74662429,"Senior Executive/Assistant Manager, Data Analytics",-,National University Health System,Central Region,Sales,New Business Development,Full time,,2024-03-22T08:14:35Z,4d ago
74713180,"Intern, Group Wholesale Banking, Data Analytics (May - Aug)",-,United Overseas Bank Limited (UOB),Central Region,Banking & Financial Services,Other,Casual/Vacation,,2024-03-25T14:28:25Z,23h ago
74661629,"Senior Executive / Assistant Manager, Data Analytics & Insights",-,National University Health System,Central Region,Information & Communication Technology,Database Development & Administration,Full time,,2024-03-22T07:39:30Z,4d ago
74647983,"Senior Executive / Assistant Manager, Data Analytics & Insights(5861)",---,NUHS Group Ops & IT,Central Region,Hospitality & Tourism,Management,Full time,,2024-03-22T01:19:03Z,4d ago
74714465,"Senior VP, Lead TDM, Platform Engineering, Data Analytics Technology",-,United Overseas Bank Limited (UOB),Central Region,Information & Communication Technology,Engineering - Software,Full time,,2024-03-25T16:11:22Z,21h ago
74716942,Data Analyst/Data Scientist,"As a data analyst, you will be responsible for compiling actionable insights from data and assisting program, sales and marketing managers build da...",BCW DLT TECHNOLOGIES PTE. LTD.,Central Region,Science & Technology,"Mathematics, Statistics & Information Sciences",Contract/Temp,,2024-03-25T02:50:00Z,1d ago
74667676,Data Analytics Audit Specialist,"Develop and implement data analytics strategies to enhance audit procedures and methodologies, incorporating emerging technologies and best practic...",Central Provident Fund Board,Central Region,Accounting,Audit - Internal,Contract/Temp,,2024-03-22T07:13:00Z,4d ago
74660593,"(Senior) Executive - (Senior) Assistant Manager - NCIS, Data Analytics",-,National University Health System,Central Region,Science & Technology,"Mathematics, Statistics & Information Sciences",Full time,,2024-03-22T06:52:43Z,4d ago
74676179,Data Analyst,"Our company specializes in electronic products. We believe in the power of data to guide and refine our business strategies, including marketing, n...",DNDTS PTE. LTD.,Central Region,Engineering,Electrical/Electronic Engineering,Full time,,2024-03-22T17:42:00Z,3d ago
74633499,"Associate, FCC Data Analytics","This role is to support the design, testing and implementation of second line of defence (""2LOD"") data analytics initiatives",Standard Chartered Bank,Central Region,Science & Technology,"Mathematics, Statistics & Information Sciences",Full time,,2024-03-21T06:54:09Z,5d ago
74702021,Senior Data Analyst Executive,Be a part of Singapore's public health care industry as a Data Analyst!,Dynamic Human Capital Pte Ltd,Central Region,Information & Communication Technology,Business/Systems Analysts,Full time,"$3,500 – $4,500 per month",2024-03-25T05:43:48Z,1d ago
74663067,Data Analyst,"Unleash insights as a Data Analyst! Dive into data, drive decisions, and fuel innovation with us. Join now!",NEO GARDEN CATERING PTE. LTD.,West Region,Science & Technology,"Mathematics, Statistics & Information Sciences",Full time,,2024-03-22T08:44:14Z,4d ago
74704117,"Assistant Manager (Data Analyst), Group Director's Office (2-Year Contract)",We are seeking a highly motivated and skilled Assistant Manager for Data Analysis to support the Applied Sciences Group of HSA. The candidate will ...,Public Service Division,Central Region,Banking & Financial Services,Analysis & Reporting,Full time,,2024-03-25T03:53:00Z,1d ago
74716219,Senior Data Analyst,"You will work in the Data Analytics team to deliver significant and action-oriented analyses and recommendations to your stakeholders, to help driv...",Agoda Company Pte. Ltd,Central Region,Science & Technology,"Mathematics, Statistics & Information Sciences",Full time,,2024-03-25T15:05:00Z,22h ago
74668103,"Technical Lead, Data Analytics, Google Cloud - Singapore",The Google Cloud Platform team helps customers transform and build what's next for their business — all with technology built in the cloud. Our pro...,Google Inc.,Central Region,Information & Communication Technology,Programme & Project Management,Full time,,2024-03-22T07:13:00Z,4d ago
74682767,"Lead Project Engineer (IOT, Big Data Analytics)","We are currently seeking a dedicated and detail-oriented individual to join our team as an IOT lead engineer.
The individual should be passionate a...",Illuminating Asia (Singapore) Pte Ltd,Central Region,Engineering,Electrical/Electronic Engineering,Contract/Temp,,2024-03-23T11:34:00Z,3d ago
74734011,Data Scientist (Contract / up to $7K),Data Analyst - Proficient in Python / R & familiar with Machine Learning,PERSOLKELLY Singapore Pte Ltd (Formerly Kelly Services Singapore Pte Ltd),Central Region,Science & Technology,"Mathematics, Statistics & Information Sciences",Contract/Temp,"$5,500 – $7,000 per month",2024-03-26T06:48:05Z,6h ago
74570578,Intern - Data Analytics and Customer Services,"Understand the overall data landscape of Mercedes-Benz for Region Overseas Market which includes data ingestion, data transformation, data modellin...",Daimler South East Asia Pte Ltd,Central Region,Science & Technology,"Mathematics, Statistics & Information Sciences",Full time,,2024-03-19T17:14:00Z,6d ago
74663182,Data Scientist,"Unleash insights as a Data Scientist! Dive into data, drive decisions, and fuel innovation with us. Join now!",NEO GARDEN CATERING PTE. LTD.,West Region,Science & Technology,"Mathematics, Statistics & Information Sciences",Full time,,2024-03-22T08:48:09Z,4d ago
74526931,Manager / Assistant Senior Manager (Data Analytics),-,National University of Singapore,Central Region,"Manufacturing, Transport & Logistics",Import/Export & Customs,Full time,,2024-03-18T05:13:56Z,8d ago
74568682,"Associate, FCC Data Analytics","· Graduate degree from a recognized university in a related discipline (e.g. Computer Science, Business analytics, Mathematics/Statistics) and/or r...",Standard Chartered Bank,Central Region,Consulting & Strategy,Management & Change Consulting,Full time,,2024-03-19T12:36:00Z,7d ago
74677643,Data Analyst (Petrochemicals | Oil & Gas | Data Models | SQL| Cloud Data),"Collaborate with the cross functional teams to comprehend department, individual data requirements, use-case specific.",Talent Trader Group Pte Ltd,Central Region,Information & Communication Technology,Database Development & Administration,Full time,,2024-03-23T01:31:04Z,3d ago
74727490,Insights & Analytics Intern (6 months),We are seeking an intern to join the Regional Insight and Analytics team (based in Singapore). Handling a range of data sources and with expertise ...,Universal Music Group,Central Region,Marketing & Communications,Digital & Search Marketing,Full time,,2024-03-26T00:17:00Z,13h ago
74714329,Health Analytics Manager,"As a health analytics manager, you will support the objectives of Prudential's health strategy, develop a roadmap and use cases that align with it,...",Prudential (WM Group- Linda Quah),Central Region,Science & Technology,"Mathematics, Statistics & Information Sciences",Full time,,2024-03-25T13:21:00Z,1d ago
74737749,"Data Analyst, Demand Planning and Supply Management","TikTok is the leading destination for short-form mobile video. At TikTok, our mission is to inspire creativity and bring joy. TikTok's global headq...",TIKTOK PTE. LTD.,Central Region,Science & Technology,"Mathematics, Statistics & Information Sciences",Full time,,2024-03-26T05:11:00Z,8h ago
74638263,"Principal Analyst, Group Finance Analytics","You will provide technical advisory to the analysts, establishing data analytics support.",Singapore Health Services Pte Ltd (SingHealth HQ),Central Region,Science & Technology,"Mathematics, Statistics & Information Sciences",Full time,,2024-03-21T09:52:30Z,5d ago
74601534,18 Months Contract Data Analytics and Operations Manager (#SAF-001),You will be responsible for the day- to-day operations due to an expansion of the the datalake scope from APAC to Global,RECRUIT EXPRESS PTE LTD,Central Region,Information & Communication Technology,Management,Contract/Temp,"$5,000 – $6,000 per month",2024-03-20T08:10:08Z,6d ago
74716190,Product Analyst,"We're seeking a talented Product Analytics professional to join our team. In this role, you'll play a pivotal role in shaping the future of our pro...",Trusty Cars Ltd.,Central Region,Science & Technology,"Mathematics, Statistics & Information Sciences",Full time,,2024-03-25T15:00:00Z,22h ago
74566173,Customer Excellence Data Analytics & Reporting Lead - CASC APAC,"The role of Commercial Excellence Data Analytics and Reporting Lead will build, improve, and execute the customers insights capability for CASC APA...",Cargill International Trading Pte Ltd,Central Region,Banking & Financial Services,Analysis & Reporting,Full time,,2024-03-19T10:47:00Z,7d ago
74603575,Data Analyst (Junior/ Entry Level),Work closely & collaborate with cross-functional teams and stakeholders to understand business requirements....,Private Advertiser,North-East Region,Science & Technology,"Mathematics, Statistics & Information Sciences",Full time,"$3,500 – $4,600 per month",2024-03-20T09:26:13Z,6d ago
74736423,Data Scientist [Data Mining | Machine Learning Algorithms],"3 years of working experience in Data Science, algorithmic engineering, or machine learning.
Data Mining.",The Supreme HR Advisory Pte Ltd,Central Region,Science & Technology,"Mathematics, Statistics & Information Sciences",Full time,"$10,000 – $15,000 per month",2024-03-26T08:10:53Z,5h ago
74537971,Business Data Analyst (Global),"Key role analyzing large datasets, identifying trends, and providing valuable insights to support strategic decision-making across the organization.",Gradiant International Holdings Pte. Ltd.,West Region,Information & Communication Technology,Business/Systems Analysts,Full time,,2024-03-18T13:22:05Z,8d ago
74710179,Lead Data Scientist – Construction & Built Environment,Meinhardt Digital Technology Solutions (DTS) is seeking an accomplished and visionary Lead Data Scientist to lead our data science initiatives and ...,Meinhardt Singapore Pte Ltd,Central Region,Science & Technology,"Mathematics, Statistics & Information Sciences",Full time,,2024-03-25T06:03:00Z,1d ago
74737928,Senior Reporting Analyst,Join TDCX and collaborate with a diverse team of talents. Work on exciting projects that help shape the future of leading brands and industries.,TDCX,Central Region,Engineering,Civil/Structural Engineering,Full time,,2024-03-26T06:09:00Z,7h ago
74540291,APAC Head of Data & Analytics - Business Development (Sales),We’re seeking a future team member for the role of APAC Head of Data & Analytics Business Development to join our GROWTH VENTURES team. This role i...,The Bank of New York Mellon,Central Region,Banking & Financial Services,Banking - Corporate & Institutional,Full time,,2024-03-18T16:17:00Z,7d ago
74502829,Data Scientist-Analytics - TikTok,"TikTok-Data Science team is responsible for all data science and analytics related work, cooperating with all key value chains in TikTok, including...",TIKTOK PTE. LTD.,Central Region,Science & Technology,"Mathematics, Statistics & Information Sciences",Full time,,2024-03-15T20:15:00Z,10d ago
74541074,"Post Doctoral Fellow (Laboratory of Systems Biology & Data Analytics), GIS",We are looking for team members who will develop cutting-edge AI/machine learning methods and pipelines to integrate and interrogate gene expressio...,A*STAR Research Entities (A*STAR),Central Region,Education & Training,Research & Fellowships,Contract/Temp,,2024-03-18T14:22:00Z,7d ago
74717509,Applications Analyst,Perform statistical analysis and use machine learning techniques to build predictive models. Communicate findings and insights to stakeholders usin...,CHARLES & KEITH GROUP,Central Region,Science & Technology,"Mathematics, Statistics & Information Sciences",Full time,,2024-03-25T15:03:00Z,22h ago
74597066,Data Analyst,Be part of a growing team,PRIMESTAFF MANAGEMENT SERVICES PTE LTD,Central Region,Information & Communication Technology,Database Development & Administration,Full time,"$6,500 – $8,000 per month",2024-03-20T05:36:51Z,6d ago
74511425,Business Risk Specialist - Data & Advanced Analytics,"We support the WM APAC business as the first-line risk management, front line support and control framework owners.",Hays Specialist Recruitment Pte Ltd,Central Region,Banking & Financial Services,Banking - Corporate & Institutional,Contract/Temp,$4000.0 - $6500.0 p.m. + Attractive salary & caree,2024-03-17T07:10:02Z,9d ago
74553451,Senior Data Analyst - Marketplace Product,"The Product Management team at Shopee is the key focal point between the business, engineering and design teams. The team is responsible for implem...",SHOPEE SINGAPORE LITE ADS,Central Region,Science & Technology,"Mathematics, Statistics & Information Sciences",Full time,,2024-03-19T01:49:00Z,7d ago
74734826,Automotive Engineer,Contribute to analytics forums and cross-functional groups by sharing learning within and beyond Global Battery Engineering and Automotive Engineer...,Lexbuild International Pte Ltd,West Region,Science & Technology,"Mathematics, Statistics & Information Sciences",Full time,,2024-03-26T03:10:00Z,10h ago
74568258,Data Analyst,"Work experience as a data analyst or in a related field.
Ability to work with stakeholders to assess potential risks.
Proficient in Microsoft Excel...",Pan-Malayan Pharmaceuticals Pte Ltd,Central Region,"Manufacturing, Transport & Logistics",Analysis & Reporting,Full time,,2024-03-19T12:35:00Z,7d ago
74668272,Lead Data Scientist,"The ideal candidate will be a strategic thinker with extensive experience in leveraging data analytics, machine learning, and AI to drive innovatio...",Meinhardt Singapore Pte Ltd,Central Region,Science & Technology,"Mathematics, Statistics & Information Sciences",Full time,,2024-03-22T07:20:00Z,4d ago
74716332,"Assistant VP, Data Engineer","The Data Engineer, Microsoft BI Developer & Administrator, is a member of the Data Analytics Technology team. This role will be responsible for the...",United Overseas Bank Limited (UOB),Central Region,Information & Communication Technology,Developers/Programmers,Full time,,2024-03-25T14:58:00Z,22h ago
74673207,"[Gov] Data Analytic| Up to $3,700| Central",Looking for a Data Analytic job in Government? Apply Now!,CGP Personnel,Central Region,Information & Communication Technology,Testing & Quality Assurance,Full time,"$2,500 – $3,500 per month",2024-03-22T13:13:15Z,4d ago
74604515,Data Analyst,He or she shall have basic training on IT programming and graduted from IT related with bachelor degree and above He or she shall be fluent in Mand...,LINEAR FURNISHINGS PTE. LTD.,Central Region,Information & Communication Technology,Networks & Systems Administration,Full time,,2024-03-20T05:20:00Z,6d ago
74734734,"Data Scientist, Risk Data Mining - Singapore","- Define risk control measurements. Quantify, generalize and monitor risk related business and operational metrics. Align risk teams and their stak...",TIKTOK PTE. LTD.,Central Region,Science & Technology,"Mathematics, Statistics & Information Sciences",Full time,,2024-03-26T03:09:00Z,10h ago
74511174,Data Analyst Intern,"Perform data analytics using tools such as Excel, SQL, Python, helping with dashboard development and report generation on a regular basis.
Provide...",INFOSUN LEARNING SYSTEMS PTE. LTD.,Central Region,Banking & Financial Services,Analysis & Reporting,Contract/Temp,,2024-03-17T04:39:00Z,9d ago
74705514,"Assistant/ Deputy Manager, Data Engineering","Your role will involve collecting, processing, storing, and integrating various data sources into Sentosa's Data Lake ecosystem.",Sentosa Development Corporation & Subsidiaries,Central Region,Information & Communication Technology,Business/Systems Analysts,Full time,,2024-03-25T07:08:49Z,1d ago
74680549,Head of Data | Healthcare [ID:601592],Head of Data Analytics,PERSOLKELLY Singapore Pte Ltd (Formerly Kelly Services Singapore Pte Ltd),Central Region,Information & Communication Technology,Architects,Full time,,2024-03-23T08:11:19Z,3d ago
74599516,"Manager, Marketing Data Analyst",An exciting opportunity is waiting for you in the newly set up Centre of Excellence (COE) Marketing Experimentation & Personalization team in Chang...,Changi Airport Group (Singapore) Pte. Ltd.,East Region,Marketing & Communications,Market Research & Analysis,Full time,,2024-03-20T04:10:00Z,6d ago
74675649,Senior Analytics Manager (Fulfilment),The Fulfilment Product Analytics Team advances product innovation with analytics and experimentation best practices. We ship a large number of feat...,GRABTAXI HOLDINGS PTE. LTD.,Central Region,Science & Technology,"Mathematics, Statistics & Information Sciences",Full time,,2024-03-22T15:01:00Z,3d ago
74456924,Data Analyst (Tech MNC/ SQL / Product Analytics / UP5.9K),Data Analyst,Adecco Personnel Pte Ltd.,Central Region,Information & Communication Technology,Business/Systems Analysts,Contract/Temp,$5k - $5900 p.m.,2024-03-14T06:26:00Z,12d ago
74734242,Data Engineer,"As part of the Data Analytics team, you will be reporting to the Head of Big Data and Database. You will work with team members and line of...",Phillip Securities Pte Ltd,East Region,Science & Technology,"Mathematics, Statistics & Information Sciences",Full time,,2024-03-26T06:53:55Z,6h ago
74712833,Strategy Intern,We are seeking a dynamic and motivated intern to join our team as a Strategy Intern. The intern will be responsible for supporting the development ...,Siemens Industry Software Pte Ltd,Central Region,Marketing & Communications,Market Research & Analysis,Full time,,2024-03-25T10:50:00Z,1d ago
74458214,"Intern, Supply Chain Project Assistant - Data Analytics / Project Management","Master’s degree or Undergraduate in Data Analytics, Logistics & Operations Management, or Supply Chain Management.
Experience in Supply Chain / Log...",ROBERT BOSCH (SOUTH EAST ASIA) PTE. LTD.,Central Region,"Manufacturing, Transport & Logistics","Purchasing, Procurement & Inventory",Full time,,2024-03-14T04:13:00Z,12d ago
74513879,Data Analyst Intern,"Looking to join a global mission to revolutionize the gaming world? Join Razer, where you'll work with a global team located across 5 continents an...",Razer Inc.,Central Region,Science & Technology,"Mathematics, Statistics & Information Sciences",Full time,,2024-03-17T17:39:00Z,8d ago
74426466,"Executive, Procurement (Data Analytics)",We know What It Takes. Join us for an exciting career in Procurement.,ST Engineering Ltd,North-East Region,"Manufacturing, Transport & Logistics","Purchasing, Procurement & Inventory",Full time,"$3,500 – $4,500 per month",2024-03-13T08:20:04Z,13d ago
74717234,Data Scientist / Software Engineer,"Under the initial sponsorship of Civil Aviation Authority of Singapore (CAAS), The MITRE Corporation, a U.S.-based, globally renowned research and ...",THE MITRE CORPORATION,East Region,Science & Technology,"Mathematics, Statistics & Information Sciences",Full time,,2024-03-25T15:02:00Z,22h ago
74423482,"Manager / Senior Manager, Data & Analytics","To lead in analytics development, managing data projects, and fostering a data-driven culture, requiring expertise in data strategy and visualization.",Sport Singapore,Central Region,Accounting,Audit - External,Full time,,2024-03-13T06:59:45Z,13d ago
74271258,"Senior Executive, NCIS Strategy Execution & Project Management Office (Data)",Data Analyst / Data Scientist,National University Hospital,Central Region,Consulting & Strategy,Strategy & Planning,Full time,,2024-03-26T02:14:35Z,11h ago
74702193,Business Analyst ( Accounting / SQL / 6 Month contract),Business Analyst (Accounting / Finance / SQL / 6 month contract),PERSOLKELLY Singapore Pte Ltd (Formerly Kelly Services Singapore Pte Ltd),Central Region,Information & Communication Technology,Business/Systems Analysts,Contract/Temp,"$3,500 – $5,000 per month",2024-03-25T05:49:12Z,1d ago
74604170,Summer Internship 2024 - Data Analyst & BI Intern,Join us this Summer for our Structured Internship Program from May to August 2024. In addition to gaining valuable work experience alongside indust...,Munich Reinsurance,Central Region,Science & Technology,"Mathematics, Statistics & Information Sciences",Full time,,2024-03-20T07:24:00Z,6d ago
74502957,Data Analyst (Petrochemicals | Data Models | Cloud Data),"Collaborate with the cross functional teams to comprehend department, individual data requirements, use-case specific.",Talent Trader Group Pte Ltd,Central Region,Science & Technology,"Mathematics, Statistics & Information Sciences",Full time,,2024-03-16T00:33:06Z,10d ago
74592527,iTero Data and Reporting Intern,We are seeking a highly motivated and analytically skilled Data Analytics Intern to join our team. This position offers an excellent opportunity fo...,Align Technologies Pte Ltd,Central Region,Science & Technology,"Mathematics, Statistics & Information Sciences",Full time,,2024-03-20T01:16:00Z,6d ago
74423270,Data Analytics Engineer Lead,Global Data Analytics Engineering Lead in the supply chain industry,Hays Specialist Recruitment Pte Ltd,Central Region,Information & Communication Technology,Architects,Contract/Temp,$10000.0 - $14000.0 p.m.,2024-03-13T06:54:24Z,13d ago
74553753,Data Science Engineer - (Python),To develop models and work with various in-house stakeholders in the manufacturing industry.,GMP Group HQ,West Region,Information & Communication Technology,Management,Full time,"$4,000 – $4,800 per month",2024-03-19T03:26:32Z,7d ago
74702732,"Manager, People Analytics",Develop and implement analytical models to generate HR insights for the business on a global scale to guide decision making and strategic planning,Keppel People Services Pte Ltd,West Region,Human Resources & Recruitment,Other,Full time,,2024-03-25T06:08:05Z,1d ago
74508014,Data Scientist,My client is a global SaaS company with offices across countries. They are forming a Data Science team in Singapore to provide market insights and ...,Dada Consultants,Central Region,Science & Technology,"Mathematics, Statistics & Information Sciences",Full time,,2024-03-16T08:19:34Z,10d ago
74604349,"Data Engineer/Scientist (Python, Java, Apache Spark, AWS)","As a Battery Insights Date Scientist in Singapore, you will architect and maintain robust data systems. Collaborate with cross-functional teams to ...",Durapower Technology (Singapore) Pte Ltd,Central Region,Science & Technology,"Mathematics, Statistics & Information Sciences",Full time,,2024-03-20T05:21:00Z,6d ago
74671841,Project Data Analyst (Sales Finance),"- Work with Largest US Consumer Electronics MNC
- Exciting project
- Training provided",Manpower Staffing Services (S) Pte Ltd - Head Office,Central Region,Accounting,Analysis & Reporting,Contract/Temp,"$3,500 – $4,500 per month",2024-03-22T12:54:10Z,4d ago
74562255,Data Scientist,• Specialist role of Data Science • Dynamic and fast-paced working environment • Great career progression opportunities,SATS Ltd.,East Region,Science & Technology,"Mathematics, Statistics & Information Sciences",Full time,,2024-03-19T07:58:07Z,7d ago
