job_id,titles,teasers,companies,locations,categorys,subCategories,job_types,salaries,dateposted,datedisplay
74325022,Data Analyst,To write R/Python scrips to transform existing data to obtain approximation of required data.,Talent Trader Group Pte Ltd,Central Region,Science & Technology,"Mathematics, Statistics & Information Sciences",Full time,"$5,000 – $7,500 per month",2024-03-08T07:57:12Z,18d ago
74604970,Business Strategy Manager,"You will be equipped with data analytics and/or data science expertise, combined with your knowledge and experience in business strategy. You will ...",PREX TECHNOLOGIES PTE. LTD.,Central Region,Information & Communication Technology,Management,Full time,,2024-03-20T05:20:00Z,6d ago
74464931,Associate data analyst,How This Opportunity Is DifferentACIA’s Climate Risk Advisory team is currently looking for an Associate Data Analyst to help empower results for o...,Aon Singapore Pte Ltd,Central Region,Science & Technology,"Mathematics, Statistics & Information Sciences",Full time,,2024-03-14T08:19:24Z,12d ago
74565736,Product Manager - Analytics,"Data Analytics Product Manager for major logistics service providers, up to 120k per annum",Hays Specialist Recruitment Pte Ltd,Central Region,Information & Communication Technology,Product Management & Development,Full time,$9000.0 - $11000.0 p.m.,2024-03-19T11:32:19Z,7d ago
74604488,Big Data Engineer / Data Architect,We are seeking for a Big Data Engineer/Data Architect to join our dynamic data support team. This candidate will be responsible for various profess...,H2 GAMES PTE. LTD.,West Region,Information & Communication Technology,Database Development & Administration,Full time,,2024-03-20T05:20:00Z,6d ago
74676128,Pricing Manager ( Regional) - West Plant,"- Able to analyise financial results, key performance indicators including orders visibility, pricing scenrios, margin capture rate analytics and p...",Sanmina-SCI Systems Singapore Pte Ltd,Central Region,Banking & Financial Services,Analysis & Reporting,Full time,,2024-03-22T17:45:00Z,3d ago
74237728,"Senior Executive, Data and Analytics,",---,Nanyang Technological University,Central Region,Science & Technology,"Mathematics, Statistics & Information Sciences",Full time,,2024-03-06T01:54:38Z,20d ago
74311549,"Bioinformatics Specialists (Lab of Systems Biology and Data Analytics), GIS","Bioinformatics Specialists (Laboratory of Systems Biology and Data Analytics), GIS","Agency for Science, Technology and Research (A*STAR)",Central Region,Science & Technology,Biotechnology & Genetics,Full time,,2024-03-08T02:40:16Z,18d ago
74667805,DATA ENGINEER,"Create and maintain data architectures that meets the needs of HDB.
Build and maintain platforms required for storage, extraction, transformation, ...",WSH Experts Pte Ltd,Central Region,Science & Technology,"Mathematics, Statistics & Information Sciences",Full time,,2024-03-22T07:25:00Z,4d ago
74461760,Senior/Research Associate (Data Science) (Assistant Manager),Embark on an exciting lifelong journey with us in making a positive difference in your career and serving our society.,Singapore University of Social Sciences,West Region,Education & Training,Research & Fellowships,Full time,,2024-03-14T09:37:49Z,12d ago
74406761,Associate Data Analyst,ACIA’s Climate Risk Advisory team is currently looking for an Associate Data Analyst to help empower results for our clients by providing high qual...,Aon Life,Central Region,Science & Technology,"Mathematics, Statistics & Information Sciences",Full time,,2024-03-12T21:28:00Z,13d ago
74633854,"Data Operation Engineer - East , MS Cloud , Hadoop , Python , Spark","Data Operation
Data Warehouse
Government Project
Cat-1 Clearance",TRUST RECRUIT PTE. LTD.,East Region,Information & Communication Technology,Database Development & Administration,Full time,"$4,000 – $6,000 per month",2024-03-21T07:07:40Z,5d ago
74340537,Data Analyst (SQL | Phyton | Data Science| Petrochemical | Oil & Gas),"Collaborate with the cross functional teams to comprehend department, individual data requirements, use-case specific.",Talent Trader Group Pte Ltd,Central Region,Science & Technology,"Mathematics, Statistics & Information Sciences",Full time,,2024-03-09T02:34:20Z,17d ago
74529545,Senior Data Engineer (Azure),"By using Azure to design and implement cloud solutions.

Basic $10,000 - $13,000 (depends on experience)
Location: Shenton Way",MTC Consulting Pte. Ltd.,Central Region,Information & Communication Technology,Database Development & Administration,Full time,"$10,000 – $13,000 per month",2024-03-18T06:22:28Z,8d ago
74640913,Senior data engineer,"We are looking for a high-calibre data experts to be a part of a fast-growing tech organization, working within a team that provides world-class an...",Allegis Group Singapore Pte Ltd,Central Region,Engineering,Electrical/Electronic Engineering,Full time,,2024-03-21T09:43:00Z,5d ago
74493367,"Service Operations Specialist | Data Analyst | Up to $5,000 | One-North",Our client is looking for a Regional Service Operations Executive with Power BI & Excel experience,Good Job Creations (Singapore) Pte Ltd,Central Region,Consulting & Strategy,Analysts,Full time,"$4,000 – $5,000 per month",2024-03-15T10:12:21Z,11d ago
74247848,"Senior Executive/Executive, Data Analytics and Prospect Research","The Advancement Office is seeking a Senior Executive/Executive who will be responsible for providing data, reports, and analysis on prospects",Singapore University of Social Sciences,West Region,Education & Training,Other,Full time,,2024-03-06T06:17:23Z,20d ago
74555458,"Research Associate, Dept of Analytics and Operations",-,National University of Singapore,Central Region,Education & Training,Research & Fellowships,Full time,,2024-03-19T04:11:15Z,7d ago
74239921,Research Associate (Data Analytics) (R00013227),-,Nanyang Technological University,Central Region,Science & Technology,"Mathematics, Statistics & Information Sciences",Full time,,2024-03-06T02:59:40Z,20d ago
74540989,Data Scientist,"We are looking for a Data Scientist, who is excited to work in a start-up environment, and build Vision AI models capable of running at internet sc...",ELITEFIT PTE. LIMITED,Central Region,Information & Communication Technology,Developers/Programmers,Full time,,2024-03-18T14:25:00Z,7d ago
74310594,"Post Doctoral Fellow (Laboratory of Systems Biology & Data Analytics), GIS","Post Doctoral Fellow (Laboratory of Systems Biology & Data Analytics), GIS","Agency for Science, Technology and Research (A*STAR)",Central Region,Science & Technology,Biotechnology & Genetics,Full time,,2024-03-08T02:10:57Z,18d ago
74434348,"Data Science Lead, Singpass Anti- Fraud","The Singpass team builds Singapore’s digital identity system. This includes various personal authentication protocols, data sharing tools, and corp...",Government Technology Agency of Singapore (GovTech),Central Region,Information & Communication Technology,Team Leaders,Full time,,2024-03-13T11:24:00Z,13d ago
74469984,Data Science Intern 900003,"● Currently enrolled in a Master's or Ph.D. program in a quantitative discipline such as statistics, machine learning, computer science, math, etc....",Tencent International Service Pte. Ltd.,Central Region,Science & Technology,"Mathematics, Statistics & Information Sciences",Full time,,2024-03-14T17:07:00Z,11d ago
74627128,Summer Internship 2024 - Actuarial Intern,Join us this Summer for our Structured Internship Program from May to August 2024. In addition to gaining valuable work experience alongside indust...,Munich Reinsurance,Central Region,Science & Technology,"Mathematics, Statistics & Information Sciences",Full time,,2024-03-20T00:17:00Z,6d ago
74294033,Data Analyst,"The incumbent will be leading projects and working with stakeholders, therefore must have the ability to design and execute complex experiments.",RecruitFirst Pte. Ltd,Central Region,Information & Communication Technology,Business/Systems Analysts,Full time,"$4,500 – $5,200 per month",2024-03-07T10:58:50Z,19d ago
74226861,"Senior/ Analyst, Data Science, Group Finance Analytics (Contract)","You will champion the development of new data science techniques, methodologies and delivery of analytics projects.",Singapore Health Services Pte Ltd (SingHealth HQ),Central Region,Science & Technology,"Mathematics, Statistics & Information Sciences",Contract/Temp,,2024-03-05T09:15:27Z,21d ago
74469917,Data Science Intern 900101,"Responsibilities: Research on state-of-the-art machine learning, deep learning, social-network data mining and recommendation algorithms with game ...",Tencent International Service Pte. Ltd.,Central Region,Science & Technology,"Mathematics, Statistics & Information Sciences",Full time,,2024-03-14T17:07:00Z,11d ago
74288283,Data Analytics Manage (Supply Chain),"Manage introduction of new products, new supply chain and new initiative forecast.
Work with regional and local commercial /marketing team to incor...",DFI Retail Group,East Region,"Manufacturing, Transport & Logistics",Analysis & Reporting,Full time,,2024-03-05T11:47:00Z,21d ago
74679939,[LTA-P&P] TRANSPORT PLANNER (RTS PLANNING),"As a transport planner with our Rapid Transit System (RTS) Planning team, you will be given the unique opportunity to shape the future transportati...",Public Service Division,Central Region,Engineering,Civil/Structural Engineering,Full time,,2024-03-23T02:09:00Z,3d ago
74371015,Data Scientist,"● Evaluations of deployed ML models to identify improvement opportunities, and implement updates and enhancements that respond effectively to evolv...",INFOWIZ PTE. LTD.,Central Region,Science & Technology,"Mathematics, Statistics & Information Sciences",Full time,,2024-03-11T14:19:00Z,14d ago
74389673,HR Data Analyst (Bank),"Join as HR Data Specialist—shape impactful analytics, forge partnerships, and drive finance's future in a dynamic team. Your opportunity starts here!",Elitez Pte Ltd,Central Region,Banking & Financial Services,Analysis & Reporting,Contract/Temp,"$4,000 – $6,000 per month",2024-03-12T06:27:28Z,14d ago
74540259,Solution Architect -Data Analytics( Azure),We are seeking a highly skilled and experienced Solution Architect – Data Analytics for AWS to join our team and play a crucial role in designing a...,SoftwareONE Pte Ltd,Central Region,Science & Technology,"Mathematics, Statistics & Information Sciences",Full time,,2024-03-18T14:51:00Z,7d ago
74202759,"Senior Data Scientist (Analytics), OmniCommerce",We are looking for a Senior Data Scientist (Analytics) to provide critical insights and drive our OmniCommerce product forward. This requires worki...,GRABTAXI HOLDINGS PTE. LTD.,Central Region,Science & Technology,"Mathematics, Statistics & Information Sciences",Full time,,2024-03-04T15:43:00Z,21d ago
74478642,Business Intelligence Analyst,The Business Intelligence Analyst will play a crucial role in extracting meaningful insights from data to contribute to strategic decision-making.,Duotech Pte. Ltd.,Central Region,Consulting & Strategy,Analysts,Full time,,2024-03-15T03:24:37Z,11d ago
74535931,Business Analyst (Power BI),Business Analyst in MNC,HCL Technologies Malaysia SDN BHD,West Region,Information & Communication Technology,Business/Systems Analysts,Full time,"$5,000 – $6,000 per month",2024-03-18T09:47:23Z,8d ago
74592625,Pricing and Analytics Intern,The Pricing & Analytics Intern will facilitate in providing innovative pricing solutions utilizing market-based and value-based pricing methodologi...,Align Technologies Pte Ltd,Central Region,Science & Technology,"Mathematics, Statistics & Information Sciences",Full time,,2024-03-20T01:16:00Z,6d ago
74298221,Data Analyst,"The mission of the AI-CoE team is to help SP to become a data-driven company and create data-centric products. As an AI-CoE team member, you will b...",SP Digital Pte Ltd,Central Region,Science & Technology,"Mathematics, Statistics & Information Sciences",Contract/Temp,,2024-03-07T10:27:00Z,19d ago
74285533,Reporting and Analytics Developer/Data Engineer - SG2424,"Unison Consulting Pte Ltd is seeking a talented Reporting and Analytics Developer/Data Engineer to join our team.
In this role, you will be respons...",Unison Consulting Pte. Ltd.,Central Region,Science & Technology,"Mathematics, Statistics & Information Sciences",Full time,,2024-03-05T09:41:00Z,21d ago
74340592,Data Analyst | Govt,Great opportunity to leverage your data analytics/ programming language skills with the government sector and build great connections.,BGC Group Pte Ltd,Central Region,Information & Communication Technology,Database Development & Administration,Contract/Temp,"$3,800 – $5,000 per month",2024-03-09T02:47:31Z,17d ago
74392576,Human Resource Data Analyst (Banking Sector | Contract),Have a interest and passion for HR and good with data analysis? Apply now!,Elitez Pte Ltd,Central Region,Banking & Financial Services,Analysis & Reporting,Full time,"$4,500 – $5,400 per month",2024-03-12T08:17:31Z,14d ago
74611746,"Manager/Senior Manager, Knowledge & Insights",You will be involved in NVPC's initiatives to understand and develop insights on the state of giving in Singapore. You will be expected to work wit...,Hyperscal Solutions,Central Region,Marketing & Communications,Market Research & Analysis,Full time,,2024-03-20T18:54:00Z,5d ago
74556930,LEAD TRAINER DATA SCIENCE & AI,Lead trainer with experience in the industry.,Institute Of Data Pte. Ltd.,Central Region,Science & Technology,"Mathematics, Statistics & Information Sciences",Contract/Temp,,2024-03-19T04:57:52Z,7d ago
74640884,Python data analyst,"EDHEC is looking to recruit a Python Data Analyst for its newest FinTech venture, Scientific Portfolio, to be based in Singapore.
Scientific Portfo...",EDHECinfra,Central Region,Banking & Financial Services,Analysis & Reporting,Full time,,2024-03-10T08:19:08Z,16d ago
74617804,HVM Product Data Planner (PDP),Minimum qualifications are required to be initially considered for this position. Preferred qualifications are in addition to the minimum requireme...,Intel Technology Asia Pte Ltd,Central Region,"Manufacturing, Transport & Logistics",Analysis & Reporting,Full time,,2024-03-20T20:19:00Z,5d ago
74199426,Reporting and Analytics Developer / Data Engineer,"We are seeking a highly skilled and experienced Big Data Engineer to join our team. The successful candidate will be responsible for designing, dev...",INNOVATIQ TECHNOLOGIES PTE. LTD.,Central Region,Information & Communication Technology,Networks & Systems Administration,Full time,,2024-03-04T09:55:54Z,22d ago
74564399,Data Analyst Assistant (up $3300 / With Exp Prefer / Hybrid) ax98,"Salary up $3300 Location: Central Working Hours: Monday to Friday, Office Hour Hybrid mode available based on office",MCI Career Services Pte Ltd,Central Region,Information & Communication Technology,Database Development & Administration,Full time,"$2,800 – $3,300 per month",2024-03-19T09:34:37Z,7d ago
74298565,Data Analyst,Assist Lead Data Analyst(LDA) with BI project implementation leveraging Yonyou BI product (integrated with Yonyou EPR system and Cloud Platforms) ;...,Yonyou (Singapore) Pte. Ltd.,Central Region,Information & Communication Technology,Management,Full time,,2024-03-07T10:34:00Z,19d ago
74445093,Business Intelligence Analyst,About the role: We are seeking a highly analytical and detail-oriented Healthcare Business Intelligence Analyst to join our Global Transformation C...,SERVITA PRIVATE LIMITED,Central Region,Information & Communication Technology,Business/Systems Analysts,Full time,,2024-03-13T22:04:00Z,12d ago
74512777,Business analyst lead,They're looking for a Business Analyst who can drive analysis and insights with key objectives to communicate and influence different teams to make...,Nicoll Curtin Group,Central Region,Accounting,Analysis & Reporting,Full time,,2024-03-17T08:19:31Z,9d ago
74628956,"Contract Staff, Institutional Statistics, up to $3,500","•	Contract
•	Jurong
•	Office Hours
•	up to $3,500",Success Human Resource Centre Pte Ltd,West Region,Science & Technology,"Mathematics, Statistics & Information Sciences",Contract/Temp,"$2,500 – $3,500 per month",2024-03-21T04:49:02Z,5d ago
74461150,"Manager, Data Analysis & Review [RPD]","Assist and support the conduct of grants’/business operations’ data analysis and to identify variances, anomalies, trends, behaviours etc. to facil...",Public Service Division,East Region,Accounting,Management,Full time,,2024-03-14T06:40:00Z,12d ago
74541656,Data Architect,Responsible for successful implementation & achievement of program objectives through leading & coordination across workstreams & dependent project...,Accenture Pte Ltd,Central Region,Information & Communication Technology,Team Leaders,Full time,,2024-03-18T14:25:00Z,7d ago
74347827,Data Analyst,Morgan McKinley is seeking Business Data Analyst for a 5 month contract assignment with a possibility to extend!,Morgan McKinley,Central Region,Science & Technology,"Mathematics, Statistics & Information Sciences",Contract/Temp,"$6,000 – $9,000 per month",2024-03-10T10:17:52Z,16d ago
74541585,"Product Manager, Analytics","Define product vision, strategy, and roadmap based on business research, customer (internal/external) needs, and competitive analysis.
Collaborate ...",DHL Express (Singapore) Pte. Ltd,Central Region,Information & Communication Technology,Product Management & Development,Full time,,2024-03-18T14:26:00Z,7d ago
74184809,Reporting and Analytics Developer/Data Engineer,"Seeking a skilled Big Data Engineer with 5-10 years' experience. Responsible for data engineering, integration, and reporting solutions.",Morgan McKinley,Central Region,Government & Defence,Other,Full time,$9700 - $12300 p.m.,2024-03-04T04:08:26Z,22d ago
74193838,Data Analytics Solution Manager,"If you're interested in this role, forward an updated copy of your CV.
Contact Lijie Ong at +65 81006059 or email lijie.ong@hays.com.sg.
Hays Reg No.:",Hays Specialist Recruitment Pte Ltd,Central Region,Information & Communication Technology,Product Management & Development,Full time,$10000.0 - $12000.0 p.m.,2024-03-04T08:51:16Z,22d ago
74496433,Business Intelligence Manager,"Reporting to the Head of Strategy & Planning, the Business Intelligence Manager will lead and manage our team of analysts. In addition to defining ...",Ninja Van,Central Region,Information & Communication Technology,Management,Full time,,2024-03-15T10:34:00Z,11d ago
74598752,Staff Data Engineer (36888-JOB),-,Illumina Singapore Pte Ltd,North Region,Information & Communication Technology,Engineering - Software,Full time,,2024-03-20T06:30:14Z,6d ago
74199495,"Senior Executive/Executive, Data Analytics and Prospect Research","As Singapore's first institute for lifelong learning, the Singapore University of Social Sciences (SUSS) champions inclusivity to bring education t...",Singapore University of Social Sciences,Central Region,Marketing & Communications,Marketing Communications,Full time,,2024-03-04T09:58:00Z,22d ago
74581794,Quantitative Researcher,"As a Quant Researcher, you will join a team of quantitative researchers who are responsible for the R&D of real-time market tick data, pre- and pos...",Hawksman Technology,Central Region,Science & Technology,"Mathematics, Statistics & Information Sciences",Full time,,2024-03-19T08:19:26Z,7d ago
74716850,"Director, Data Science","At American Express, you’ll be recognized for your contributions, leadership, and impact—every colleague has the opportunity to share in the compan...",AMERICAN EXPRESS INNOVATION LABORATORIES LIMITED (SINGAPORE BRANCH),Central Region,Information & Communication Technology,Team Leaders,Full time,,2024-03-25T15:07:00Z,22h ago
74737046,Research Associate (Ageing Studies/Data Science/Informatics/Psychology/Sociology,-,Nanyang Technological University,Central Region,Education & Training,Research & Fellowships,Full time,,2024-03-26T08:44:27Z,4h ago
74716603,"Senior Manager, Data Science","At American Express, you’ll be recognized for your contributions, leadership, and impact—every colleague has the opportunity to share in the compan...",AMERICAN EXPRESS INNOVATION LABORATORIES LIMITED (SINGAPORE BRANCH),Central Region,Information & Communication Technology,Team Leaders,Full time,,2024-03-25T15:06:00Z,22h ago
74540955,Data Science Lead - User Growth TikTok,"The Growth team plays a core role in acquisition, activation, and retention of billions of users, through our globally popular products such as Tik...",TIKTOK PTE. LTD.,Central Region,Science & Technology,"Mathematics, Statistics & Information Sciences",Full time,,2024-03-18T14:25:00Z,7d ago
74734391,"Manager, Machine Learning Engineer","You will be responsible for productionalizing ML models developed by data scientists. He/she will be the central point for ML models refactoring, o...",United Overseas Bank Limited (UOB),Central Region,Science & Technology,"Mathematics, Statistics & Information Sciences",Full time,,2024-03-26T03:10:00Z,10h ago
74564481,Research Assistant / Associate (Digital Health and Data Science),-,National University of Singapore,Central Region,Education & Training,Research & Fellowships,Full time,,2024-03-19T09:38:50Z,7d ago
74715879,Machine Learning Engineer,We are seeking a highly skilled Machine Learning Engineer with expertise in Large Language Model (LLM) training and architecture. The ideal candida...,RESEARCHMYUSERS PTE. LTD.,Central Region,Education & Training,Research & Fellowships,Full time,,2024-03-25T15:05:00Z,22h ago
74731532,Research Engineer (Engineering/ AI / Machine Learning) - WP3,-,Singapore Institute of Technology,Central Region,Information & Communication Technology,Engineering - Software,Contract/Temp,,2024-03-26T05:52:38Z,7h ago
74737862,Data Engineer,"Looking for candidates available to work:
Monday: Morning, Afternoon, Evening
Tuesday: Morning, Afternoon, Evening
Wednesday: Morning, Afternoon, E...",MooVita Pte Ltd,Central Region,Information & Communication Technology,Team Leaders,Full time,,2024-03-26T06:20:00Z,7h ago
74688456,AI Engineer (Preferred with FSI experiences)- ID: 599871,"Design, implement, and optimize machine learning and deep learning algorithms to solve real-world problems.",PERSOLKELLY Singapore Pte Ltd (Formerly Kelly Services Singapore Pte Ltd),Central Region,Engineering,Electrical/Electronic Engineering,Full time,"$15,000 – $20,000 per month",2024-03-24T15:26:23Z,1d ago
74716464,"Customer Engineer, Applied AI and Generative AI - Singapore","As a Customer Engineer, you will work directly with technical Sales teams as a machine learning subject matter expert to differentiate Google Cloud...",Google Inc.,Central Region,Information & Communication Technology,Programme & Project Management,Full time,,2024-03-25T15:04:00Z,22h ago
74729151,Research Fellow / Engineer (geospatial data) - MG,-,Singapore Institute of Technology,Central Region,Education & Training,Research & Fellowships,Full time,,2024-03-26T04:16:41Z,9h ago
74673431,"Manager, Machine Learning Engineer, Group Market and Enterprise Technology","Group Technology and Operations (GTO) provides software and system development, information technology support services and banking operations.
We ...",United Overseas Bank Limited (UOB),Central Region,Science & Technology,"Mathematics, Statistics & Information Sciences",Full time,,2024-03-22T10:23:00Z,4d ago
74610066,Machine Learning Engineer,"We are seeking a Data Analyst / Machine Learning Engineer to join our dynamic team. As a Data Analyst / Machine Learning Engineer, you will play a ...",ST Engineering Ltd,Central Region,Science & Technology,"Mathematics, Statistics & Information Sciences",Full time,,2024-03-20T12:00:00Z,6d ago
74434910,Assistant Manager – Data Science Product Owner,"We are looking for intellectually curious, highly motivated and customer-focused individuals to build Advanced Analytics and Data Science capabilit...",Daimler South East Asia Pte Ltd,West Region,Information & Communication Technology,Management,Full time,,2024-03-13T11:22:00Z,13d ago
74365226,Internship: Data Science (May - Dec 2024),"To be successful in this role, you will need…
The following technical skills and experience :
• Currently pursuing a Bachelor's Degree in Data Scie...",Danone Specialized Nutrition (Singapore) Private Limited,Central Region,Science & Technology,"Mathematics, Statistics & Information Sciences",Full time,,2024-03-11T07:25:00Z,15d ago
74726027,Research Fellow (IDS-Cisco),Research Fellow (IDS-Cisco),National University of Singapore,Central Region,Education & Training,Other,Full time,,2024-03-26T02:55:31Z,10h ago
74681721,AI Engineer (Natural Language Processing)-AI Singapore,AI Engineer (Natural Language Processing)-AI Singapore,National University of Singapore,Central Region,Education & Training,Other,Full time,,2024-03-23T10:15:20Z,3d ago
74731565,Research Fellow/Associate (Brain Computer Interface) - VAP,-,Singapore Institute of Technology,Central Region,Healthcare & Medical,Clinical/Medical Research,Contract/Temp,,2024-03-26T05:54:14Z,7h ago
74674164,Data Engineer (Oracle) - J44085,We are looking for Data Engineer with experience in Oracle database to join a fast growing IT software company in Singapore!,ScienTec Consulting Pte Ltd,Central Region,Information & Communication Technology,Networks & Systems Administration,Full time,"$5,500 – $7,000 per month",2024-03-22T15:27:48Z,3d ago
74686191,ENGINEER - PLN Operation Intelligence,"Knowledge and experience in data analytics, business intelligence and machine learning is a plus.",MICRON SEMICONDUCTOR ASIA OPERATIONS PTE LTD,Central Region,Engineering,Electrical/Electronic Engineering,Full time,,2024-03-24T01:49:00Z,2d ago
